subreddit,id,title,author,score,num_comments,created_utc,url,selftext
careerguidance,1ojtm5i,Do I have to resign or just keep going?,Least_Mine_2248,1,2,1761810661.0,https://www.reddit.com/r/careerguidance/comments/1ojtm5i/do_i_have_to_resign_or_just_keep_going/,"Hello everyone! I just want to ask for your advice po. I've been working in this company for 2 months now. I’ve already adjusted and gotten used to the tasks I need to do — actually, I’ve already memorized most of them, and I sometimes feel bored. But that’s not really the main reason why I’m thinking of looking for another job.  The thing is, this company often informs me about tasks at the last minute — like they’ll suddenly say I need to do this or that. Sometimes, I also have to work during holidays since I’m the only employee in my position who’s required to be present. Before signing my Job Offer, I was told that I wouldn’t be assigned to this location all the time, and that I’d mostly work in a branch nearer to my place. But now, I’ve been here for almost 3 months and can count on my fingers how many times I’ve worked at the nearer branch. The salary is also quite low, and the schedule is tough because of the travel time — it takes me around 2 hours to get to work and 2–3 hours to get home due to heavy traffic.  So I want to ask for your suggestions po: Should I start looking for a new job and just resign once I already have a backup? Or should I stay longer since this is my first job? It’s becoming really frustrating since my head sometimes gives different instructions, and it’s getting confusing. Huhu, please help po"
careerguidance,1ojtj5b,SHOULD I LEAVE HIGHSCHOOL?,OkWait3322,0,8,1761810318.0,https://www.reddit.com/r/careerguidance/comments/1ojtj5b/should_i_leave_highschool/,"Pls read til the end, I badly need your advices,  I spent the first three years of my teenage years in a conservative religious boarding school, at the time I left, I decided to pursue education and to experience what other teenagers experience. I spent two years finishing 10th and 11th grade through the ALS Accelerating program.  Now I'm 18 and currently in 12th grade, I decided to go to an actual highschool to meet teenagers my age, and experience highschool as I've been yearning for them since I wasted my first three years of teenagehood trying to mature up and be serious about religion.  I was thrilled with my new encounters and activities in school, like meeting new people, exploring hobbies they introduce to me, dancing, eating at the canteen, walking home with friends, and simple daily highschool stuff which mean a lot to me bec I was never able to experience them before. But lately, I started feeling so drained and tired of the routine, projects here and there, listening and sitting all day, teachers treating us like we're in a workplace. I wanna leave inspite having two great bestfriends there, honestly they're the only reasons why I still somehow wanna stay.  I just realized lately that I won't be shining there, academics really isn't my thing anymore. I crave for new experiences like hobbies and skills(hiking, knitting, cooking, joining workshops and events, learing a martial art), and those stuff are not what I'll be able to find in an educational field (i.e highschool). I planned on switching to ALS Acceleration Program again where I would only attend school once a week, and I'll have 6 days for work to fund my dream experiences and explore more stuff that I could've explored during 6 hours of sitting in school everyday.  But the consequeces I'll face is, I might miss some highschool experiences or memories that might be waiting for me.  Note: I'm still under my parent's roof so  wont have to worry about moving out yet til I graduate 12th grade, and I won't be staying in that job either, I wish to build financial freedom so I won't have to be an employee for the rest of my life.  SO, SHOULD I SWITCH TO ALS ACCELERATION PROGRAM? OR STAY IN HIGHSCHOOL?"
careerguidance,1oj61qw,Isnit legal for PTO to be evoked AFTER the trip was taken?,BEN9116,24,63,1761748147.0,https://www.reddit.com/r/careerguidance/comments/1oj61qw/isnit_legal_for_pto_to_be_evoked_after_the_trip/,"Hello, i was recently approved for PTO on an unlimited plan according to the software for a birthday/ medical trip for about a week.  (2 days out the time off was for personal, the 5 days was for medical and received a doctor's note after)  I have been back to work at this small company for about 3 days now from my trip, (worked here for 5-6 months) and I was sent a message last night saying I didnt have any more vacation days by my boss, I stated I didnt have any more days planned so thats not a problem and he said ""no I mean for the trip you already took""  and that he would go over my timesheet when he gets back.   Is this legal? I would have stayed the extra 2 days if I had known, I make way less then I should as a media manager for a very small company (like less then 10 employees on the office side)  im not sure what im going to do if he doesnt pay me for the week he had approved and is now saying I dont have but it was already taken. Any advice pls.  TLDR: boss said I dont habe vacation time AFTER It was approved and I already took it and came back. Is this legal or any advice?"
careerguidance,1ojmzqw,What's the next step after graduating if you feel lost?,Quirky_Animator8945,3,3,1761788232.0,https://www.reddit.com/r/careerguidance/comments/1ojmzqw/whats_the_next_step_after_graduating_if_you_feel/,"Anyone who's out there please give me some advice. I'm a 24f psych undergrad student about to graduate.   When I picked my major, it was my 2nd time changing it (bio--&gt; graphic design --&gt; psych). I went through a bout of emotional/mental crises during college that severely affected my performance as a student. I didn't have the college experience I expected and as a whole its been mostly negative.   I have loved psych and my main interest was either neuropsych or forensics.  My plan was to continue with the phd. But... where i live, Puerto Rico(a US territory) there is NO such thing as fully funded phds. Most admissions committees would find that laughable; here its normal &amp; expected to go into debt for your phd.   I really don't think it would be responsible of me to rack up another $30k in debt when I already have about $8k in student loans. I have thought about getting a master's, seeing as the masters in psych allows you to work as a psychologist in PR (laws are different in that regard here). But the masters here aren't accredited by any US board.  Either way, the salary for these degrees seems like it would not be a good return on investment (I understand the median salary for psychologists here is 40k). I am in a position where I need to consider that extensively; I don't have the luxury of a safety net nor am I comfortable having loans until I reach 50 like so many people here seem to be.  I've considered other careers like medicine or allied health careers. I was originally a bio major with the intention of being pre-dentistry but I dropped out because I struggled with chemistry. I don't know how many people drop out of bio and then successfully re-transition into those fields. What's more I feel like I lack the purpose or passion to pursue anything as grandiose as medicine because I don't really believe I'm intellectually capable.  It feels too late for me, I feel hopeless and like my path is set and there's little I can do about it."
careerguidance,1ojmosx,Should I Leave Before Things Get Worse?,LuckyMagicBrownie,3,1,1761787383.0,https://www.reddit.com/r/careerguidance/comments/1ojmosx/should_i_leave_before_things_get_worse/,"So I graduated in December 2024 and began work as a legal assistant in March of this year. I didn’t mind my job and the benefits were great, but the commute was awful, the attorneys treated me lowly, and i began to feel it wasn’t what i wanted to do.  I was going to stick it out for a year, but i got a job offer in April for a job I had applied for months previously, as an Assistant director of a non-profit, and it shortened my commute from one hour to five minutes and my pay increased by 25%. So, i took it.  At this job, i like my coworkers, my job tasks are relatively easy, and my hours are flexible. However, my manager is unstable, the organization’s future is unclear, and i have limited growth opportunities. My boss lies and constantly makes excuses, claiming he works 50-60 hour weeks when we barely see him in the office for 40. Not to mention, one time in a fit of rage he damaged an office wall by punching a hole through it upon finding out i had gone home early for the day. As an organization, we only have money for payroll through the end of the year and once that comes and goes, our future payroll will depend on grants or donations. Further, my only place for advancement is my managers position, which i have a solid chance of getting one day, but due to our financial situation i wonder if that day will come.  I miss my tasks as a legal assistant and want to go back to it, but with 2 months working there on my resume and 6 months working here, i wonder if i should just stick it out or my résumé’s sake until we go under or to jump ship now. Any advice?"
careerguidance,1ojt5u7,Is it bad to change jobs too often early in your career?,Sweetpeadangerbutton,1,3,1761808794.0,https://www.reddit.com/r/careerguidance/comments/1ojt5u7/is_it_bad_to_change_jobs_too_often_early_in_your/,I’ve switched jobs a few times in the last two years because I wanted to try different roles. Now I’m worried employers might see it as a red flag. Do hiring managers actually care that much about job hopping if I have good reasons?
careerguidance,1ojstjf,Do you think a toxic office culture is worth it? I don’t think so??,SeaProperty497,1,2,1761807431.0,https://www.reddit.com/r/careerguidance/comments/1ojstjf/do_you_think_a_toxic_office_culture_is_worth_it_i/,"Hello everyone, I will try to keep this as short as possible. Recently about 5 months ago I started with a big company (coming from a construction field) and into a corporate role. The transition into office culture was okay but obviously different. I was a bit rough around the edges but I am experienced in what I was employed for but a bit rough on the office culture stuff you know. Anyway long story short there were really nice people, but I feel I had a target on my back from my first week, maybe because of my background, or I’m somewhat out of my comfort zone. Here’s a quick recap of why:  - my work computer was reassigned to a more senior staff by my  manager in my first week (because they didn’t have one yet) This had all my personal information like salary, next of kin, along will my work emails and logins. The company is very big on privacy etc.  - KPIs were never explained or implemented or even discussed by management.  - job description not clearly defined, and management couldn’t encompass what’s required. - Management we’re quite young and treated staff like Childeren, over the top praise eg you guys have done absolutely amazing today, but then next day say how disappointed they were and threatened firing someone (on their phone)  -other staff using my work login as theirs was not working, this had all my personal details on there.  - Very minimal training despite me telling management I need more constantly. They organised training but lasted literally 5 mins then it was cancelled. - work hours was explained to be flexible then changed to a rigid hours. - had to work over Christmas period, never discussed before. - little guidance and support but management, would Tell their superiors that they are made mistakes, and deflected responsibility. - my direct manager became passive aggressive as I swapped a working from home with working from office. The job is totally computer based. The manager told me to come in the office when everyone if working at home as punishment.  - excluded from some team meetings without explanation. Managers giving me instructions via email to another employee, when they are sitting beside me. - managers in their own echo chambers and very power hungry. - higher above managers not even saying hi in the elevator or walk past with acknowledgment. - a lot of my questions (work related ignored in the chat and glanced over)  -witnessed manager making fun on a co worker on cctv who injured themselves at work and is on leave.   What did it for me was my direct manager telling me to come into work, when I was working from home. I explained that I had family responsibility and to switch days (only required 2 days p/w in office) they doubled down and told me to come into the office. It was a power struggle for them, and it highlighted I didn’t want to work here anymore.   Unfortunately Im done with this culture and it’s disappointing as it’s a big career move for me. Has anyone ever experienced this sort of thing? Has not helped with my daily enjoyment and made me feel quite down to be honest. Has anyone else experienced this? I can get work easily. I almost want to make a complaint to HR but know it would be a waste of time."
careerguidance,1ojssks,Should I consult my HR?,Routine-Owl-204,1,2,1761807323.0,https://www.reddit.com/r/careerguidance/comments/1ojssks/should_i_consult_my_hr/,"Hello,  I am planning to resign from my first job after 4 months. It is in auto loan sales in a bank.  I am conflicted about whether to request HR for a department change before I put in my papers so I wanted to get some opinions.  I appreciate any guidance and advice at this moment."
careerguidance,1ojjxsy,How to get over the guilt of quitting a non profit?,Right-Assistance-531,5,6,1761780004.0,https://www.reddit.com/r/careerguidance/comments/1ojjxsy/how_to_get_over_the_guilt_of_quitting_a_non_profit/,"I've been with a non-profit teaching company for the past 6 years that I have desperately wanted to leave but they keep giving me responsibilities that make it so if I was to leave, the company would likely collapse. These responsibilities have come with a small increase in pay but not enough to justify the amount of work and I often end up doing unpaid labor because no one else is able to step up and handle it (or no one else is willing). My bosses are kind but largely chaotic and disorganized and I am left cleaning up their messes. I KNOW I need to leave this job, but every time I even consider looking somewhere else I am overcome with the guilt and shame that they will go under without me (they have said as much multiple times; when I had to take a couple months off to recover from a surgery my bosses freaked out over the stress) I understand this type of guilt and shame is one of the ways some non-profits keep their employees, but I cannot get past it and because the job market is as bad as it is I've convinced myself that I can't find anything better. How do I move past the guilt to at least start exploring another path?"
careerguidance,1ojsl18,Staying in consultanting or moving to sde?,Horror_Leg3303,1,0,1761806497.0,https://www.reddit.com/r/careerguidance/comments/1ojsl18/staying_in_consultanting_or_moving_to_sde/,"I am working as an analyst in deloitte usi rn, its been just a year. But I dont know if I even like my job, I have technical bg, but they are making me do a lot of docs and qa work. My work doesn't involve any coding n all. Its about CDP tools, initially it sounded interesting to me, but now i feel done with. Should I get out of consultanting and try into sde roles in product based companies, where should I start preparing Need guidance"
careerguidance,1ojjkjj,Is the tech industry for me? Should I even bother trying to get an entry-level CS job anymore?,kyxst,4,3,1761779077.0,https://www.reddit.com/r/careerguidance/comments/1ojjkjj/is_the_tech_industry_for_me_should_i_even_bother/,"22M, just recently graduated from university with a degree in computer science.  I think I applied to university mostly because I felt like I had to. I was a smart kid that felt like I needed to attend university so I wouldn’t let myself or my family down by wasting my potential. I also wasn’t mentally ready to leave school and abandon the routine/structure that school provided. I originally majored in math because it was my best subject in high school and I genuinely enjoyed solving math problems, but then I started to get worried about what careers I could pursue with a math degree. Everyone was telling me it wasn’t the best decision to major in math, so since math and computer science are kinda related in a way and people have always said that tech is a good industry to pursue, I switched to computer science.  I always considered myself to be a good CS student. I’ve gotten A’s in almost every CS class I’ve taken, I never cheated on my assignments or tests, and I really enjoyed learning a lot of the concepts I learned in university. That being said, I never really did anything related to CS outside of my coursework. I spent all my time in school focusing on my coursework, and then any free time I got went towards TV, video games, or doomscrolling. I never did any internships, side projects, or volunteer work in my 5 years of university. I’ve lived with my parents my whole life and I don’t have a single bit of job experience (not even from a minimum wage job).  Now that I’m out of school and looking for jobs, I’m really questioning what the hell I’ve been doing for the past 5 years. I’ve been applying to jobs for a few months now, but I haven’t gotten a single interview. I have nothing to put on my resume other than my degree (as well as some programming languages I know), and I don’t have the motivation or passion to do side projects. As for volunteering and internships, I’m unsure if I wanna do that or not. A few people have also suggested to me the idea of pursuing a master’s degree, but that just feels like it would be a sunk cost. I have to start paying back my student loans soon, and I don’t know if I can afford to go back to school again (at least right now).  I don’t think I’m built for this job market. I see posts on Reddit all the time about people in CS who have years of experience and tons of side projects, yet they can’t get jobs. That along with the rise of AI and everyone getting laid off makes me feel incredibly insecure because I feel like I could never stick out in this industry. If people with tons of CS experience can’t get CS related jobs, what are the odds that I could ever get one?  I really regret not taking a gap year between high school and university to consider what I wanted to do with my career. I also regret never stopping once to actually decide if CS is what I wanted to pursue (university was hard, so I just kept telling myself “do the work now, worry about career stuff later”). I have enjoyed doing CS while I was in school (for example, I really enjoyed making apps and websites for course projects), but I don’t think I necessarily have a passion for CS. In fact, I don’t even know if I have a passion in any field as of right now.  This post might be a giant mess, but I just don’t know what to do anymore. Should I keep trying to apply for entry-level CS jobs and pray that one of these recruiters somehow chooses me for an interview? Should I just work a minimum wage job? I owe so much money in student loans right now, and I don’t want my computer science degree to go to waste, but I just don’t feel confident that I could get a computer science related job. I also feel like I’m scared to let people down."
careerguidance,1ojsi1u,Which one would you pick if you were to choose again? DM or SEO?,Immediate-Lab961,1,0,1761806150.0,https://www.reddit.com/r/careerguidance/comments/1ojsi1u/which_one_would_you_pick_if_you_were_to_choose/,"I’m currently changing my career path (Psychology graduate) and trying to become an SEO specialist. I’m still pretty new to SEO and don’t have any formal experience in digital marketing, apart from doing some basic marketing for clubs and organizations. I have also been assisting a YouTuber with their channel, creating and editing educational videos, and optimizing thumbnails and titles.  What really draws me to SEO is the flexibility (in the future) it offers. Once you gain experience, you can work independently or even freelance, which sounds perfect for me. I also like how it combines analysis and creativity, and I think digital marketing in general is fun and meaningful, especially when it helps communities or small businesses grow.  I’m just not sure what’s the better move. If you had to choose again, which path would you take? Do you start with a digital marketing specialist role to get a broader foundation, or go straight for an SEO-focused position (like an SEO specialist role) so you can build your skills in that area from the start?  I’ve seen people say both routes work differently, so I’d love to hear what worked best for you."
careerguidance,1ojshtl,18M how to figure out what career to do in life?,Few-Peach9215,1,4,1761806124.0,https://www.reddit.com/r/careerguidance/comments/1ojshtl/18m_how_to_figure_out_what_career_to_do_in_life/,"When I was in high school, I had no idea what I wanted to do as a career. I made it into uni and chose to do an chemical engineering degree and now it has been a year and I want to switch as I’m not enjoying the degree and haven’t found it interesting at all. I still don’t know what I want to do in life, and well I feel like I’m running out of time. There’s no career that has appealed to me at all. Most people say find something that aligns with your interests but like I don’t have many interests. I like sport but like a sporting career is definitely not happening lol, I was strong in math and chemistry in high school hence choosing the chemical engineering degree. I considered teaching for about, but the low pay just kinda makes me not want to. I just want a career that I’m happy with and gets paid decently, but even these days I swear every job I search up seems like the pay is not well unless you’re like a doctor or something like that. Is anyone currently in a similar situation or has been in the past? How’d you guys figure out what you wanted to do cause I just feel so lost, and feel like I’ve messed up my life."
careerguidance,1ojshsv,What skill should I learn in 2025 if I want to change careers and earn a better salary?,West_Lemon6995,0,3,1761806121.0,https://www.reddit.com/r/careerguidance/comments/1ojshsv/what_skill_should_i_learn_in_2025_if_i_want_to/,"Hi, I’m 25 years old and I work as an assistant manager in a company. I graduated with a degree in Economics, specializing in Public Administration, and I’m currently in my second year of a master’s program in the same field. However, I’m not satisfied with the salary — neither in my current job nor in the field I studied. I’d like to take a course to learn a skill that’s in demand and well-paid. Do you have any ideas? I’m open to any advice. Thank you!"
careerguidance,1ojsg76,Corporate vs Startup?,Mysterious_Body9403,1,0,1761805944.0,https://www.reddit.com/r/careerguidance/comments/1ojsg76/corporate_vs_startup/,"I'm 27 years old and have been at a startup for 5 years after studying.   Now got 2 opportunities:   1. Account executive at a global VAT reclaim and compliance company   2. Position (TBC) at a startup in the the digital identity, regtech and fintech infrastructure industry.   I'm thinking long term, option 2 would be a better choice to get involved early and career growth, rather than a big corporate like option 1. However, a big corporate would offer some more stability, but I know that now is the time to give it a bash.   Please let me know your thoughts - looking for some more opinions.   Thank you"
careerguidance,1ojscc1,Anyone here done the Gusto People Advisory Accelerator? Need some honest insights.,hard2resist,1,0,1761805538.0,https://www.reddit.com/r/careerguidance/comments/1ojscc1/anyone_here_done_the_gusto_people_advisory/,"Folks, I’m looking into the People Advisory Accelerator and wanted to hear from people who’ve actually completed it. How was the program in terms of real value? Did it genuinely help you offer better advisory services?"
careerguidance,1ojs3xg,what should I do?,mwahb4e,1,1,1761804610.0,https://www.reddit.com/r/careerguidance/comments/1ojs3xg/what_should_i_do/,so I'm in 10th std rn icse and I have no idea what to do next. my parents are telling me to pursue engeneering cuz they both are software n hardware engineers. my dad is forcing me crazy to do diploma after 10th and then engeneering (as that's what he did) but for some reason i definitely know I don't want to do that. i feel like if I go in diploma the environment will be too bad too soon and I won't get many options and idts companies would want to hire ppl with diploma only in today's competition. but I honestly have no idea what else to do. I think I should do architecture or law or engeneering but I don't think I'm capable of it. pls guide and advice me on this.
