subreddit,id,title,author,score,num_comments,created_utc,url,selftext
MachineLearning,1o81atp,[R][D] A Quiet Bias in DL’s Building Blocks with Big Consequences,GeorgeBird1,0,9,1760605834.0,https://www.reddit.com/r/MachineLearning/comments/1o81atp/rd_a_quiet_bias_in_dls_building_blocks_with_big/,"*TL;DR: Deep learning’s fundamental building blocks — activation functions, normalisers, optimisers, etc. — appear to be quietly shaping how networks represent and reason. Recent papers offer a perspective shift: these biases drive phenomena like superposition — suggesting a* ***new symmetry-based design axis for models***. *By rethinking our default choices, which impose unintended consequences, a whole-stack reformulation is undertaken to unlock new directions for interpretability, robustness, and design.*  &gt;**Symmetries in primitives act like lenses**: they don’t just pass signals through, they warp how structure appears - ***a 'neural refraction' -*** even the very **notion of neurons is lost**.  [Showing just the activation function reformulations, standard ones \(anisotropic\) while new isotropic-tanh right](https://preview.redd.it/a99retx44gvf1.png?width=1085&amp;format=png&amp;auto=webp&amp;s=be66b8a53ca0e28ff4b8abecb2e685bc94838812)  *This reframes several interpretability phenomena as function-driven, not fundamental to DL, whilst producing a new ontology for deep learning's foundations.*  &gt;Swapping the building blocks can wholly alter the representations from discrete clusters (like ""*Grandmother Neurons*"" and ""***Superposition***"") to smooth distributions - this shows this foundational bias is strong and ***leveragable for improved model design***.  # The 'Foundational Bias' Papers:  **Position (2nd) Paper: Isotropic Deep Learning (IDL) \[**[**link**](https://doi.org/10.5281/zenodo.15476947)**\]:**  &gt;*TL;DR: Intended as a provocative position paper proposing the ramifications of redefining the building block primitives of DL. Explores several research directions stemming from this symmetry-redefinition and makes* ***numerous falsifiable predictions***. Motivates this new line-of-enquiry, indicating its implications from *model design* *to theorems contingent on current formulations. When contextualising this, a taxonomic system emerged providing a generalised, unifying symmetry framework.*  Primarily showcases *a new symmetry-led design axis across all primitives*, introducing a programme to learn about and leverage the consequences of building blocks as a new form of control on our models. The consequences are argued to be significant and an underexplored facet of DL.  Predicts *how* our default choice of primitives may be quietly biasing networks, causing *a range* of unintended and interesting phenomena across various applications. New building blocks mean ***new network behaviours to unlock*** and avoid hidden harmful 'pathologies'.  This paper directly challenges any assumption that primitive functional *forms* are neutral choices. Providing *several predictions* surrounding interpretability phenomena as side effects of current primitive choices (*now empirically confirmed, see below*). Raising questions in optimisation, AI safety, and potentially adversarial robustness.  &gt;There's also a [***handy blog***](https://medium.com/@george.bird.uom/draft-a-hidden-inductive-bias-at-the-heart-of-deep-learning-4e197b56f34c) that runs through these topics in a hopefully more approachable way.  **Empirical (3rd) Paper: Quantised Representations (PPP) \[**[**link**](https://arxiv.org/pdf/2507.12070)**\]:**  &gt;*TL;DR: By altering primitives it is shown that current ones cause representations to clump into clusters ---* *likely undesirable* *--- whilst symmetric alternatives keep them smooth.*  Probes the consequences of altering the foundational building blocks, assessing their effects on representations. Demonstrates how foundational biases emerge from various symmetry-defined choices, including new activation functions.  Confirms an IDL prediction: anisotropic primitives induce discrete representations, while isotropic primitives yield smoother representations that may support better interpolation and organisation. It disposes of the 'absolute frame' discussed in the SRM paper below.  A **new perspective on several interpretability** **phenomena**, instead of being considered fundamental to deep learning systems, this paper instead shows *our choices induce them* ***— they are not fundamentals of DL!***  'Anisotropic primitives' *are sufficient* to induce discrete linear features, grandmother neurons and potentially superposition.  * Could this eventually affect how we pick activations/normalisers in practice? *Leveraging symmetry, just as ReLU once displaced sigmoids?*  **Empirical (1st) Paper: Spotlight Resonance Method (SRM) \[**[**link**](https://arxiv.org/abs/2505.13471)**\]:**  &gt;*TL;DR: A new tool shows primitives force activations to align with hidden axes, explaining why neurons often seem to represent specific concepts.*  This work shows there must be an ""absolute frame"" created by primitives in representation space: neurons and features align with special coordinates imposed by the primitives themselves. Rotate the basis, and the representations rotate too — revealing that phenomena like ""grandmother neurons"" or superposition may be induced by our functional choices rather than fundamental properties of networks.  This paper motivated the initial reformulation for building blocks.  # Overall:  Hopefully, an exciting research agenda, with a tangent enquiry on symmetry from existing GDL and Parameter Symmetries approaches.  Curious to hear what others think of this research arc so far:  * What reformulations or consequences (positive or negative) interest you most? Any implications I've missed? * If symmetry in our primitives is shaping how networks think, *should we treat it as a core design axis*?  I hope this research direction may catch your interest for future collaborations on:  &gt;*Discovering more undocumented effects of our functional form choices could be a productive research direction*, alongside designing new building blocks and leveraging them for better performance."
MachineLearning,1o6hs2w,[D] Only 17 days given to review 5 papers in ICLR 2026...,casualcreak,117,40,1760453822.0,https://www.reddit.com/r/MachineLearning/comments/1o6hs2w/d_only_17_days_given_to_review_5_papers_in_iclr/,The paper assignments for ICLR 2026 are in today and I was assigned 5 papers to review. The review deadline is 31st October. I am not sure if this is the normal time period but seems very little. Last year I was assigned 2 papers and was able to write detailed and constructive reviews.
MachineLearning,1o70jyv,[D] Curious asymmetry when swapping step order in data processing pipelines,Eastern_Ad7674,7,8,1760499338.0,https://www.reddit.com/r/MachineLearning/comments/1o70jyv/d_curious_asymmetry_when_swapping_step_order_in/,"Hi everyone,     I’ve been running some experiments with my own model where I slightly reorder the steps in a data-processing pipeline (normalization, projection, feature compression, etc.), and I keep seeing a consistent pattern:   one order gives stable residuals, while the reversed order systematically increases the error term — across very different datasets.  It doesn’t look like a random fluctuation; the gap persists after shuffling labels and random seeds.  Has anyone seen similar order-sensitivity in purely deterministic pipelines?   I’m wondering if this could just be numerical conditioning or if there’s something deeper about how information “settles” when the operations are reversed."
MachineLearning,1o62zfe,[D] Why are Monte Carlo methods more popular than Polynomial Chaos Expansion for solving stochastic problems?,Alternative_iggy,154,25,1760407073.0,https://www.reddit.com/r/MachineLearning/comments/1o62zfe/d_why_are_monte_carlo_methods_more_popular_than/,"I feel like MC methods are king for reinforcement learning and the like, but PCE’s are often cited as being more accurate and efficient. Recently while working on some heavy physics focused problems I’ve found a lot of the folks in Europe use more PCE. Anyone have any thoughts as to why one is more popular? If you want to do a fun deep dive - polynomial chaos (or polynomial chaos expansion) have been a fun random stats deep dive."
MachineLearning,1o6bdfd,[D] Dataset release - Unannotated Real world retail images 2014 &amp; 3 full store reference visits (14-16),malctucker,10,1,1760436191.0,https://www.reddit.com/r/MachineLearning/comments/1o6bdfd/d_dataset_release_unannotated_real_world_retail/,"Happy to release some of our 1m image datasets for the wider community to work with.  2014 set (full-res), unannotated, ships with manifest.csv (sha256, EXIF, dims, optional GPS). c. 6000 images across 22 retailers. These are of numerous elements in stores, ends, aisles, products etc.  • Reference visits: Tesco Lincoln 2014, Tesco Express 2015, Asda Leeds 2016 (unannotated; each with manifest). These are full stores (2014 not bay by bay but the other two stores are) c. 1910 items.  • Purpose: robustness, domain shift, shelf complexity, spatial awareness in store alongside wider developmental work.  • License: research/eval only; no redistribution.  • Planned v2: 2014 full annotations (PriceSign, PromoBarker, ShelfLabel, ProductBlock in some cases) alongside numerous other tags around categories, retailer, promo etc.  Contact: [happytohelp@groceryinsight.com](mailto:happytohelp@groceryinsight.com) for access and manifests which are being worked up. Questions welcomed."
MachineLearning,1o5zhqo,[D]: Interview prep: What LC questions were u asked for AI/MLE/Research scientist roles,lan1990,50,53,1760397416.0,https://www.reddit.com/r/MachineLearning/comments/1o5zhqo/d_interview_prep_what_lc_questions_were_u_asked/,My understanding is that they generally don't ask LC hard problems. But in your recent interview experience what problems were u asked.. please let us know as it's wild wild west out here  Edit - LC I mean is leet code not ml coding where they ask u implement a transformer
MachineLearning,1o6g9b7,[D] Should I attend EMNLP 2025 in-person?,Greedy_Succotash_919,4,13,1760450299.0,https://www.reddit.com/r/MachineLearning/comments/1o6g9b7/d_should_i_attend_emnlp_2025_inperson/,Hi all! My paper got accepted into a workshop in EMNLP 2025. I'm having a hard time deciding if I should attend it virtually or in-person.  I'm a 2nd year undergraduate student (major not related to CS). This is my first paper and I have a few ML projects under my belt.  I would like some thoughts on the pros and cons of attending. How beneficial will the networking be? Will I be overlooked because of my major🫠? What should I actively do so that this benefits my career?  PS: I will be getting some funds from my university and I would have to pay only a few hundred dollars at max and miss classes.
MachineLearning,1o6ay44,[P] Generate detection rules,Only_Emergencies,3,4,1760434641.0,https://www.reddit.com/r/MachineLearning/comments/1o6ay44/p_generate_detection_rules/,"I would like to get your ideas. I am working on a project to automatically generate cybersecurity detection rules from blogs and/or user requests.   My initial approach hasn’t worked very well so far. I suspect this is because the model I’m using (`Kimi-K2`) struggles with the domain, as it differs from the data it was originally trained on. I’ve also experimented with `Qwen3-32B` with similar results.  There are a few key requirements:  * The system must run on-premises, due to the sensitive nature of detection rule data. * It must be able to generate detection rules from blog posts and/or user requests.  For example:      Can you write a rule for Linux that detects suspicious use of the cron utility, specifically when crontab jobs are being created or modified from files in the `/tmp` directory? I want this to focus on potential abuse for persistence or execution of malicious code, and it should be based on process creation logs. Please include ATT&amp;CK mappings for T1053.003 and note that legitimate admin activity could be a false positive.  Or:      Generate a detection rule based on this: https://cloud.google.com/blog/topics/threat-intelligence/prc-nexus-espionage-targets-diplomats  # My Current Approach  1. **Content extraction** – I use *crawl4ai* to fetch the content from URLs. 2. **Content summarization** – Since the raw content is often noisy, I summarize it to remove unnecessary elements such as cookie banners, headers, or navigation menus, while trying to preserve as much relevant information as possible. 3. **Similarity retrieval** – I retrieve similar detection rules from our internal database using a hybrid search approach, which works reasonably well. 4. **Draft generation** – I make an initial LLM request to generate a first draft of the rule, using a few-shot setup that includes the retrieved similar rules as context. 5. **Reflection loop** – I validate the generated rule’s syntax. If an error is found, the system re-enters the previous step, this time including the error message as additional context.  However, this approach performs poorly. The detection block in the generated rules often fails to capture the actual detection logic correctly, leading to rules that look valid syntactically but don’t work effectively for their intended purpose.  I also experimented with breaking down the generation process into multiple steps. For instance, first asking the model to determine the detection path or flow based on the blog content or user request. However, the results are still not very good.  Now, I am considering fine-tuning a model using LoRA with a custom dataset that includes:  * The blog post or user request as input, and * The corresponding final detection rule as output.  I’d like to get your opinion on this approach and hear about other methods or architectures that might yield better results. Thank you!"
MachineLearning,1o5gojz,"[D] Need career advice, just got rejected for an Applied Scientist role at Microsoft",gyhv,128,41,1760353468.0,https://www.reddit.com/r/MachineLearning/comments/1o5gojz/d_need_career_advice_just_got_rejected_for_an/,"Currently, I work in a company where most, if not all, of my job revolves around consuming tools and APIs. I feel completely lost, as I’m forgetting the technical side of things since I’m no longer building or deploying anything, just using pre-existing cloud services.  Yes, I’ve gained some cloud skills and I’m certified in both Azure and AWS, but I feel like I’m slowly killing my career. I got an interview at Microsoft last month and got rejected (which hit hard, not gonna lie). I had studied well, but when I talked about my projects, they felt dull, mostly about building simple RAG systems and connecting GPT APIs to other tools. The position required building and fine-tuning LLMs, which my company doesn’t support me to do at all.  Right now, my self-esteem is really low. I feel like a slop because I’m just a consumer of products, not a creator. I don’t know what to do.  I work another part-time job that’s also focused on consuming APIs, so I don’t have time to do anything else.  thinking about dropping my part-time job so I can focus on my weak points."
MachineLearning,1o5wpu3,[D] TEE GPU inference overhead way lower than expected - production numbers,ssunflow3rr,17,7,1760390594.0,https://www.reddit.com/r/MachineLearning/comments/1o5wpu3/d_tee_gpu_inference_overhead_way_lower_than/,"Been running models in trusted execution environments for about 4 months now and finally have enough data to share real performance numbers.  Backstory: we needed to process financial documents with LLMs but obviously couldn't send that data to external APIs. Tried homomorphic encryption first but the performance hit was brutal (like 100x slower). Federated learning didn't work for our use case either.  Ended up testing TEE-secured inference and honestly the results surprised me. We're seeing around 7% overhead compared to standard deployment. That's for a BERT-based model processing about 50k documents daily.  The setup uses Intel TDX on newer Xeon chips. Attestation happens every few minutes to verify the enclave hasn't been tampered with. The cryptographic verification adds maybe 2-3ms per request which is basically nothing for our use case.  What really helped was keeping the model weights inside the enclave and only passing encrypted inputs through. Initial load time is longer but inference speed stays close to native once everything's warm.  For anyone doing similar work with sensitive data, TEE is actually viable now. The performance gap closed way faster than I expected.  Anyone else running production workloads in enclaves? Curious what performance numbers you're seeing."
MachineLearning,1o6f798,"[D] AAAI: Not able to post ""Ethics Chair comment"" on a review",Lost-Ingenuity5017,0,1,1760447702.0,https://www.reddit.com/r/MachineLearning/comments/1o6f798/d_aaai_not_able_to_post_ethics_chair_comment_on_a/,"https://preview.redd.it/4flfqzj2u2vf1.png?width=1604&amp;format=png&amp;auto=webp&amp;s=039506a12d6d6cee2813c0ba2bfa2214412a6534  I am trying to post an ""Ethics Chair Author Comment"" for a review, and it keeps giving me error that Ethics Chair are not added. And there is no option to add ""Ethics Chair"" here too.  Anyone else also facing same issue, how did you solve this? Or any chairs from AAAI can help with this, that will be really grateful?"
MachineLearning,1o67ypt,pilot access to anonymised demographic + location datasets for AI fairness and model evaluation [P],Crumbedsausage,1,0,1760422955.0,https://www.reddit.com/r/MachineLearning/comments/1o67ypt/pilot_access_to_anonymised_demographic_location/,"I’m a founder based in Australia working on Datalis, a project focused on making AI evaluation fairer and more transparent.  We’ve built consent-verified, anonymised demographic and location panels that can be used to test models for bias, robustness, and representativeness. Everything’s aggregated — no personal data, no scraping, no PII — just structured ground-truth panels built ethically.  We’ve just opened a free 30-day pilot program for AI teams and researchers who want to benchmark or stress-test their models against real demographic and geographic data. You’ll get a few CSV/Parquet samples (US + AU regions) and a short guide on how to integrate them into your evaluation workflow.  If you’re working on fairness, alignment, or model eval, or know someone who is, you can request pilot access here: 👉 datalis.app/pilot  Happy to answer questions in the comments or trade notes with anyone tackling the same problem."
MachineLearning,1o5gdtr,[D] Presenting NeurIPS paper at EurIPS,mio_11,28,13,1760352482.0,https://www.reddit.com/r/MachineLearning/comments/1o5gdtr/d_presenting_neurips_paper_at_eurips/,"Hi, I have a NeurIPS poster to present. I initially selected SD as my choice of venue, but my US Visa application was rejected. I was hoping to present at EurIPS, but I am being told by my supervisors that I gotta present at Mexico if not SD. Is that true - is it not enough to present at EurIPS?  If I gotta present at Mexico, and I don't, say I don't get my visa or I don't feel safe flying to Mexico, what's going to happen? Are they going to retract my paper? Can someone else attending the conference, who is not an author on my paper, present in my place?"
datasets,1oju9mp,"Announcement: definitely less complex data analysis solution, EasyAIBridge",Infamous-Win834,0,0,1761813389.0,https://www.reddit.com/r/datasets/comments/1oju9mp/announcement_definitely_less_complex_data/,"Gap-Filling Intelligence, Smart Ask, Instant Reports, Supporting Multiple Sources. Powered by Fusion Intelligence. Delivers faster and more detail-oriented AI-based data analysis, visualization. reporting, scheduling, and exporting. Launching on producthunt today: [https://www.producthunt.com/products/easy-ai-bridge](https://www.producthunt.com/products/easy-ai-bridge)"
datasets,1oj5nh5,Is there any subreddit/place on the internet that works as a datasets repository? Like not well known but credible ones?,Wrong_Talk781,4,6,1761747212.0,https://www.reddit.com/r/datasets/comments/1oj5nh5/is_there_any_subredditplace_on_the_internet_that/,Or is this subreddit the right place for that?
datasets,1ojcmee,Looking for guidance on open-sourcing a hierarchical recommendation dataset (user–chapter–series interactions),Just_Plantain142,1,0,1761762852.0,/r/recommendersystems/comments/1ojceuo/looking_for_guidance_on_opensourcing_a/,
datasets,1oj3v6q,“All I Want For Christmas Is You” by Mariah Carey streams for Spotify and AppleMusic daily since their start?,GeoMicroSoares,0,0,1761742808.0,https://www.reddit.com/r/datasets/comments/1oj3v6q/all_i_want_for_christmas_is_you_by_mariah_carey/,"Hi y'all, it would be super cool to have a dataset of daily streams of “All I Want For Christmas Is You” by Mariah Carey for Spotify and AppleMusic since these each started recording that data (prob 2013?). Would anyone be able to provide something like that? Would be much appreciated."
datasets,1oj1e1v,European Auto Data Startup: Partners &amp; Providers Wanted,cauchyez,1,4,1761735454.0,https://www.reddit.com/r/datasets/comments/1oj1e1v/european_auto_data_startup_partners_providers/,"We are about to launch a **new automotive data project**, offering a highly detailed vehicle report for car checks. We will operate **exclusively in the European market**. Most of the data is already in place through our providers, but we are still exploring the market and are **open to new collaborations**.  We are looking for people who can help with the project: **data providers, industry professionals**, etc. Specifically, we are interested in providers for:  * **Commercial use status** (taxi, rental, etc.) * **Recalls** * **Damage information / Mileage information** * Any other relevant data that could be integrated into our reports  We expect **high volumes from launch**, as we already have a **large affiliate network and strong industry connections**.  Thank you!"
datasets,1oj9gzp,Is AI going to replace data analyst jobs soon?,Infamous_Chapter9623,0,6,1761755929.0,/r/dataanalysiscareers/comments/1oj0js2/is_ai_going_to_replace_data_analyst_jobs_soon/,
datasets,1oiki97,"How do you keep large, unstructured data sources manageable for analysis?",Hour-Ad7177,0,3,1761683354.0,https://www.reddit.com/r/datasets/comments/1oiki97/how_do_you_keep_large_unstructured_data_sources/,"I’ve been exploring ways to make analysis faster when dealing with multiple, messy datasets (text, coordinates, files, etc.).  What’s your setup like for keeping things organized and easy to query  do you use custom tools, spreadsheets, or databases?"
datasets,1oi9tbh,Finance-Instruct-500k-Japanese Dataset,Ok_Employee_6418,3,0,1761659204.0,https://huggingface.co/datasets/ronantakizawa/Finance-Instruct-500k-Japanese,"Introducing the Finance-Instruct-500k-Japanese dataset 🎉      This is a Japanese dataset that includes complex questions and answers related to finance and economics.   This dataset is useful for training, evaluating, and instruction-tuning LLMs on Japanese financial and economic reasoning tasks."
datasets,1oiuqv8,"You, Too can now leverage ""Artificial Indian""",lostinspaz,0,5,1761710301.0,https://www.reddit.com/r/datasets/comments/1oiuqv8/you_too_can_now_leverage_artificial_indian/,"There was a joke for a while, that ""AI"" actually stood for ""Artificial Indian"", after multiple companys' touted ""AI"" turned out to be a bunch of outsourced, low cost-of-living country workers remotely, behind the scenes.  I just found out that AWS's assorted SageMaker AI offerings, now offer direct, non-hidden Artificial Indian for anyone to hire, through a convenient interface they are calling ""Mechanical Turk"".  [https://docs.aws.amazon.com/sagemaker/latest/dg/sms-workforce-management-public.html](https://docs.aws.amazon.com/sagemaker/latest/dg/sms-workforce-management-public.html)     I'm posting here, because its primary purpose is to give people a standardized AI to pay for HUMAN INPUT on labelling datasets, so I figured the more people on the research side who knew about this, the better.  Get your dataset captioned by the latest in AI technology! :)     (disclaimer: I'm not being paid by AWS for posting this, etc., etc.)"
datasets,1oibdxd,Will using synthetic data affect my ML model accuracy or my resume?,shrinivas-2003,1,6,1761662893.0,https://www.reddit.com/r/datasets/comments/1oibdxd/will_using_synthetic_data_affect_my_ml_model/,"Hey everyone 👋 I’m currently working on my final year engineering project based on disease prediction using Machine Learning.  Since real medical datasets are hard to find, I decided to generate synthetic data for training and testing my model. Some people told me it’s not a good idea — that it might affect my model accuracy or even look bad on my resume.  But my main goal is to learn the entire ML workflow — from preprocessing to model building and evaluation.  So I wanted to ask: 👉 Will using synthetic data affect my model’s performance or generalization? 👉 Does it look bad on a resume or during interviews if I mention that I used synthetic data? 👉 Any suggestions to make my project more authentic or practical despite using synthetic data?  Would really appreciate honest opinions or experiences from others who’ve been in the same situation 🙌"
