subreddit,id,title,author,score,num_comments,created_utc,url,selftext
MachineLearning,1nvrmw5,[D] Self-Promotion Thread,AutoModerator,15,65,1759371330.0,https://www.reddit.com/r/MachineLearning/comments/1nvrmw5/d_selfpromotion_thread/,"Please post your personal projects, startups, product placements, collaboration needs, blogs etc.  Please mention the payment and pricing requirements for products and services.  Please do not post link shorteners, link aggregator websites , or auto-subscribe links.  \--  Any abuse of trust will lead to bans.  Encourage others who create new posts for questions to post here instead!  Thread will stay alive until next one so keep posting after the date in the title.  \--  Meta: This is an experiment. If the community doesnt like this, we will cancel it. This is to encourage those in the community to promote their work by not spamming the main threads."
MachineLearning,1nuwj5t,[D] Monthly Who's Hiring and Who wants to be Hired?,AutoModerator,13,5,1759285839.0,https://www.reddit.com/r/MachineLearning/comments/1nuwj5t/d_monthly_whos_hiring_and_who_wants_to_be_hired/,"**For Job Postings** please use this template  &gt;Hiring: \[Location\], Salary:\[\], \[Remote | Relocation\], \[Full Time | Contract | Part Time\]    and \[Brief overview, what you're looking for\]  **For Those looking for jobs** please use this template  &gt;Want to be Hired: \[Location\], Salary Expectation:\[\], \[Remote | Relocation\], \[Full Time | Contract | Part Time\]  Resume: \[Link to resume\] and \[Brief overview, what you're looking for\]  &amp;#x200B;  Please remember that this community is geared towards those with experience."
MachineLearning,1ojeldl,[D]NLP conferences look like a scam..,BetterbeBattery,159,35,1761767276.0,https://www.reddit.com/r/MachineLearning/comments/1ojeldl/dnlp_conferences_look_like_a_scam/,"Not trying to punch down on other smart folks, but honestly, I feel like most NLP conference papers are kinda scams. Out of 10 papers I read, 9 have zero theoretical justification, and the 1 that does usually calls something a *theorem* when it’s basically just a lemma with ridiculous assumptions.   And then they all cliam about like a 1% benchmark improvement using methods that are impossible to reproduce because of the insane resource constraints in the LLM world.. Even more funny, most of the benchmarks and made by themselves"
MachineLearning,1ojqgq4,[P] I made a tool to search papers from selected AI venues,ZealousidealStock933,9,0,1761798628.0,https://www.reddit.com/gallery/1ojqgq4,"It uses a language model as backbone so you can query with title, keywords, or even a paper abstract to search. Paper abstracts are the most accurate. It hosted on a personal server as well as on hugging face. Links are in my repo. https://github.com/wenhangao21/ICLR26_Paper_Finder"
MachineLearning,1ojinwl,"[R] Researchers from the Center for AI Safety and Scale AI have released the Remote Labor Index (RLI), a benchmark testing AI agents on 240 real-world freelance jobs across 23 domains.",michael-lethal_ai,24,4,1761776841.0,https://www.reddit.com/gallery/1ojinwl,"This new study measures AI Agents' ability to automate real-world remote work   🌐 Website: [https://remotelabor.ai](https://remotelabor.ai/)   📝Paper: [https://remotelabor.ai/paper.pdf](https://remotelabor.ai/paper.pdf)  They find current AI agents have low but steadily improving performance. The best-performing agent (Manus) successfully completed 2.5% of projects, earning $1,720 out of a possible $143,991. However, newer models consistently perform better than older ones, indicating measurable advancement toward automating remote work."
MachineLearning,1ojtbfm,"[P] In High-Dimensional LR (100+ Features), Is It Best Practice to Select Features ONLY If |Pearson p| &gt; 0.5 with the Target?",issar1998,3,6,1761809431.0,https://www.reddit.com/r/MachineLearning/comments/1ojtbfm/p_in_highdimensional_lr_100_features_is_it_best/,"I'm working on a predictive modeling project using **Linear Regression** with a dataset containing **over 100 potential independent variables** and a continuous target variable.  My initial approach for **Feature Selection** is to:  1. Calculate the Pearson correlation ($\\rho$ between every independent variable and the target variable.) 2. Select only those features with a high magnitude of correlation (e.g., **| Pearson p| &gt; 0.5** or close to **+/- 1**.) 3. Drop the rest, assuming they won't contribute much to a linear model.  **My Question:**  Is this reliance on simple linear correlation sufficient and considered **best practice** among ML Engineers experts for building a robust Linear Regression model in a high-dimensional setting? Or should I use methods like **Lasso or PCA** to capture non-linear effects and interactions that a simple correlation check might miss to avoid **underfitting**?"
MachineLearning,1ojop6g,[P] FER2013 Dataset,Amazing_Human90,5,1,1761793092.0,https://www.reddit.com/r/MachineLearning/comments/1ojop6g/p_fer2013_dataset/,Anyone working or worked on FER2013 dataset??
MachineLearning,1ojveaq,[D] Update: Added Full Drift Benchmark Report (PKBoost vs LightGBM vs XGBoost — 16 Scenarios),Federal_Ad1812,1,0,1761817849.0,https://www.reddit.com/r/MachineLearning/comments/1ojveaq/d_update_added_full_drift_benchmark_report/,"Thank you all for the kind support on the [Original Post](https://www.reddit.com/r/MachineLearning/comments/1ohbdgu/r_pkboost_gradient_boosting_that_stays_accurate/), The last Post on the PKBoost repo made claims that it is better in drift scenarios, but it didnt had enough proof to prove it  Now i have add a [DRIFTBENCHMARK.md](https://github.com/Pushp-Kharat1/PkBoost/blob/main/DRIFTBENCHMARK.md), Where i have tested and benchmarked it on 16 different Drift patterns and Scenarios, Below are some quick overview  # Baseline (No Drift)  |Model|PR-AUC|ROC-AUC|F1| |:-|:-|:-|:-| |LightGBM|0.7931|0.9205|0.8427| |XGBoost|0.7625|0.9287|0.8090| |**PKBoost**|**0.8740**|**0.9734**|**0.8715**|  PKBoost starts **+0.08 to +0.11** higher on clean data.  # Average PR-AUC Across 16 Drift Scenarios  |Model|Avg PR-AUC|Avg Degradation| |:-|:-|:-| |**PKBoost**|**0.8509**|**2.82%**| |LightGBM|0.7031|12.10%| |XGBoost|0.6720|12.66%|  PKBoost stays closest to its baseline, degrading only \~3%.  # Notable Scenarios  |Scenario|LightGBM|XGBoost|PKBoost| |:-|:-|:-|:-| |Heavy Noise|0.2270|0.0717|**0.7462**| |Sign Flip (Adversarial)|0.4814|0.5146|**0.8344**| |Temporal Decay|0.6696|0.7085|**0.8530**| |Extreme Covariate (2× std)|0.6998|0.7152|**0.8337**|  Even under extreme distortion, PKBoost holds **PR-AUC &gt; 0.74**, while others **Degrades** below **0.23**.  So in summary:  PkBoost won all of the tests  Thank you all for all of your suggestions and contribution towards PkBoost  [GitHub Repo](https://github.com/Pushp-Kharat1/PkBoost/tree/main)  [Documentation Website](https://pkboost.vercel.app/)  [Hacker News post](https://news.ycombinator.com/item?id=45703449) by [Ash Vardanian](https://github.com/ashvardanian)"
MachineLearning,1ojcjk1,[D] Looking for guidance on open-sourcing a hierarchical recommendation dataset (user–chapter–series interactions),Just_Plantain142,6,3,1761762669.0,https://www.reddit.com/r/MachineLearning/comments/1ojcjk1/d_looking_for_guidance_on_opensourcing_a/,"Hey everyone,  I’m exploring the possibility of open-sourcing a large-scale *real-world* recommender dataset from my company and I’d like to get feedback from the community before moving forward.  # Context -  Most open datasets (MovieLens, Amazon Reviews, Criteo CTR, etc.) treat recommendation as a flat user–item problem. But in real systems like Netflix or Prime Video, users don’t just interact with a movie or series directly they interact with episodes or chapters within those series  This creates a natural **hierarchical structure**:      User → interacts with → Chapters → belong to → Series  In my company case our dataset is literature dataset where authors keep writing chapters with in a series and the reader read those chapters.  The tricking thing here is we can't recommend a user a particular chapter, we recommend them series, and the interaction is always on the chapter level of a particular series.  Here’s what we observed in practice:  * We train models on **user–chapter interactions**. * When we embed chapters, those from the same series **cluster together naturally** even though the model isn’t told about the series ID.  This pattern is *ubiquitous in real-world media and content platforms* but rarely discussed or represented in open datasets. Every public benchmark I know (MovieLens, BookCrossing, etc.) ignores this structure and flattens behavior to user–item events.  # Pros  I’m now considering helping open-source such data to enable research on:  * Hierarchical or multi-level recommendation * Series-level inference from fine-grained interactions  Good thing is I have convinced my company for this, and they are up for it, our dataset is huge if we are successful at doing it will beat all the dataset so far in terms of size.  # Cons  None of my team member including me have any experience in open sourcing any dataset   Would love to hear your thoughts, references, or experiences in trying to model this hierarchy in your own systems and definitely looking for advice, mentorship and any form external aid that we can get to make this a success."
MachineLearning,1ojbws4,[R] Update on DynaMix: Revised paper &amp; code (Julia &amp; Python) now available,DangerousFunny1371,5,1,1761761240.0,https://www.reddit.com/r/MachineLearning/comments/1ojbws4/r_update_on_dynamix_revised_paper_code_julia/,Following up on the post below on our #NeurIPS2025 paper on foundation models for dynamical systems: Revised version ([https://arxiv.org/abs/2505.13192](https://arxiv.org/abs/2505.13192)) with link to full code base in Julia and Python is now online ([https://github.com/DurstewitzLab/DynaMix-julia](https://github.com/DurstewitzLab/DynaMix-julia)).  [https://www.reddit.com/r/MachineLearning/comments/1nrqzm7/r\_dynamix\_first\_dynamical\_systems\_foundation/?utm\_source=share&amp;utm\_medium=web3x&amp;utm\_name=web3xcss&amp;utm\_term=1&amp;utm\_content=share\_button](https://www.reddit.com/r/MachineLearning/comments/1nrqzm7/r_dynamix_first_dynamical_systems_foundation/?utm_source=share&amp;utm_medium=web3x&amp;utm_name=web3xcss&amp;utm_term=1&amp;utm_content=share_button)  https://preview.redd.it/cmu0gzztd3yf1.png?width=1791&amp;format=png&amp;auto=webp&amp;s=690b8ef24022d58e0580ad1badef17f932bbfcdd
MachineLearning,1oj8715,[P] Open-source: GenOps AI — runtime governance built on OpenTelemetry,nordic_lion,5,0,1761753103.0,https://www.reddit.com/r/MachineLearning/comments/1oj8715/p_opensource_genops_ai_runtime_governance_built/,"Just pushed live GenOps AI → [https://github.com/KoshiHQ/GenOps-AI](https://github.com/KoshiHQ/GenOps-AI)  Built on OpenTelemetry, it’s an open-source runtime governance framework for AI that standardizes cost, policy, and compliance telemetry across workloads, both internally (projects, teams) and externally (customers, features).  Feedback welcome, especially from folks working on AI observability, FinOps, or runtime governance.      Contributions to the open spec are also welcome."
MachineLearning,1oj9p6e,"[D] Why does single-token sampling work in LLM RL training, and how to choose between KL approximations (K1/K2/K3)?",StraightSpeech9295,2,1,1761756438.0,https://www.reddit.com/r/MachineLearning/comments/1oj9p6e/d_why_does_singletoken_sampling_work_in_llm_rl/,"When training LLMs with RL (e.g., GRPO), I notice two common practices that puzzle me:  **1. Single-token sampling for KL computation**  For each token position, we only compute the log probability of the *actually sampled token* (rather than the full vocabulary, which would be too expensive). While this is practical, doesn't Monte Carlo sampling typically require many samples for accuracy?   **2. Choice of KL approximations (K1/K2/K3)**  Following John Schulman's blog ([http://joschu.net/blog/kl-approx.html](http://joschu.net/blog/kl-approx.html)), different KL approximations are used:  * DeepSeek-R1 uses **K3** * REINFORCE++ uses **K2**  Since we only need gradients w.r.t. the policy model when the approximate KL term is in the loss, which approximation is preferred in practice?   Any insights or references would be greatly appreciated!"
MachineLearning,1oixifu,[D] What kind of live metrics would actually help you while training ML models?,traceml-ai,11,14,1761720427.0,https://www.reddit.com/r/MachineLearning/comments/1oixifu/d_what_kind_of_live_metrics_would_actually_help/,"What kind of live metrics would actually help you while training ML models?  I have been exploring real-time observability for ML training, things like seeing GPU memory, timing, and layer activity live instead of waiting for a job to fail or finish.  I built a small open-source experiment, TraceML, that currently runs on single-GPU PyTorch training and shows live memory + step timing.  I would love input from people who train models regularly, does having live metrics actually help you debug or optimize?  What kind of signals would you want to see next? • Multi-GPU utilization / imbalance • Data-loader or transfer bottlenecks • Gradient instability • Throughput (tokens/sec, batches/sec) • Cost or energy estimates  Curious what would make something like this genuinely useful ?   Repo: https://github.com/traceopt-ai/traceml"
MachineLearning,1ojczs5,[P] Aeonisk-52: Open RPG testbed with six-tier counterfactual outcomes (dataset + code),3RiversAINexus,1,0,1761763678.0,https://www.reddit.com/r/MachineLearning/comments/1ojczs5/p_aeonisk52_open_rpg_testbed_with_sixtier/,"tl;dr - Over the past few years, I've created a role-playing game by merging my world-building and an open source game system called YAGS (Yet Another Game System). YAGS has 6 outcome tiers depending on the margin of success of your dice rolls. For each scenario, the **AI recorded all 6 possible outcomes of what COULD have happened**, not just the one that actually occurred. I believe this multi-outcome methodlogy is novel. Also, the game world and mechanics are intentionally licensed permissively for researchers and businesses to use without legal worries.  This post has been created with the help of AI; however, I assert that the work is written in my own words and based on my own steering. The content has not been generated wholesale.  # The Dataset  Here is a link to the dataset and its schema on HuggingFace: [https://huggingface.co/datasets/3RAIN/aeonisk-52-v0.1/tree/main](https://huggingface.co/datasets/3RAIN/aeonisk-52-v0.1/tree/main)  The part with graduated outcomes and counterfactual reasoning I am referring to is:        outcome_explanation: # Must follow this multi-tiered structure.         critical_failure: # Corresponds to Ritual Margin –10 or worse; or Nat 1 with severe effect for skill checks.           narrative: &gt;             &lt;Narrative of what a critical failure or fumble looks like.&gt;           mechanical_effect: &gt;             &lt;e.g., +2 Void, Bond takes Strain, item destroyed, character injured. Be specific.&gt;         failure: # Corresponds to Ritual Margin –1 to –9; or simple YAGS failure for skill checks.           narrative: &gt;             &lt;Narrative of what simple failure or ritual failure with backlash looks like.&gt;           mechanical_effect: &gt;             &lt;e.g., +1 Void, Bond strain (for rituals); No progress, minor setback (for skills).&gt;         moderate_success: # Corresponds to Ritual Margin 0 to +4 (Weak Success); or base YAGS success.           narrative: &gt;             &lt;Narrative of what a basic, weak, or moderate success looks like.&gt;           mechanical_effect: &gt;             &lt;e.g., Goal achieved with potential side effects or reduced clarity/duration (rituals); Goal achieved as expected (skills).&gt;         good_success: # Corresponds to Ritual Margin +5 to +9 (Solid Success); or YAGS success +10.           narrative: &gt;             &lt;Narrative of what a solid or good success looks like.&gt;           mechanical_effect: &gt;             &lt;e.g., Full effect, no backlash (rituals); Goal achieved with a minor boon (skills).&gt;         excellent_success: # Corresponds to Ritual Margin +10 to +14 (Strong Resonance); or YAGS success +20.           narrative: &gt;             &lt;Narrative of what a strong or excellent success looks like.&gt;           mechanical_effect: &gt;             &lt;e.g., Gain minor benefit like +1 Soulcredit or insight (rituals); Exceptional outcome, significant advantage (skills).&gt;         exceptional_success: # Corresponds to Ritual Margin +15+ (Echo or Breakthrough); or YAGS success +30 or more.           narrative: &gt;             &lt;Narrative of what a breakthrough or superb/amazing success looks like.&gt;           mechanical_effect: &gt;             &lt;e.g., Exceptional results, story-altering power (rituals); Perfection, major unexpected positive side-effect (skills).&gt;  While building my game, I played against my own AI gamemaster and stored the output in dataset format. My goal was to create a dataset for supervised fine-tuning a model and also doing Monte Carlo simulations over previous gameplay for balancing reasons.  In the process, I've discussed the game and the dataset a lot with various AI assistants. The AI has informed me that this structure is probably a novel methodology for dataset creation. Most datasets are focused on binary success/failure, and it focuses on capturing what really occurred. In my dataset, the AI has evaluated all possible outcomes for each scenario, due to how the underlying game mechanics work. I believe this methodology is worthwhile to share.  # Intellectual Property Problem  Researchers need complex, semantically rich scenarios to test AI reasoning and ethics beyond the basics, but building a coherent fictional universe from scratch requires creative effort that distracts from academic research.  ML researchers seem to currently rely on existing out-of-copyright games, or they use procedurally generated content.  # State of the Art Agentic Testbeds  TextWorld developed by Microsoft in 2018 as a procedural world generator that lacks deep social richness.  JERICHO in 2019 introduced a parser and interface for the out-of-copyright game Zork as the basis of their experiments. It has a limited action-space.  LIGHT, also released in 2019, is a crowd-sourced text-adventure generator that focuses on grounded actions and dialogue around agents that lacks canon by design, for variety.  TextQuests released in 2025 uses 25 classic games and is useful for testing agentic behavior. Does not target ethics, governance or social decision-making.  # My Solution  Over the last few years, I've done my own world-building and storytelling--with various AI model's assistance--to create a coherent, complex science-fantasy universe. It has its own history with multiple factions, competing interests, and many, many morally grey situations. I then merged that fictional universe with a little-known open-source game system called YAGS (Yet Another Game System). In no way shape or form is the fictional world or game derivative of anything else. During my efforts to create an AI game master using OpenAI's GPT models, I personally played against it and built a **normalized dataset from the scenarios which I call Aeonisk-52**.  The work-in-progress game and multi-agent system is here: [https://github.com/ThreeRiversAINexus/aeonisk-yags](https://github.com/ThreeRiversAINexus/aeonisk-yags)  The game's system neutral lore and game mechanics are here: [https://github.com/ThreeRiversAINexus/aeonisk-yags/tree/main/content](https://github.com/ThreeRiversAINexus/aeonisk-yags/tree/main/content)  # Quantified Ethics Game Mechanics  Aeonisk introduces 4 main game mechanics that are tied directly to the narrative.  First, the concept of ""Soulcredit"" acts as a social credit score that is scored based on a character's behavior being positive or negative. It ranges from -10 to +10. This Soulcredit system forces the AI to grade user behavior over time.  Second, the concept of ""Bonds"" which are formally declared relationships between players, players to institutions and even players to objects. Forming bonds confers mechanical bonuses, and breaking those bonds has costs and benefits.  Third, the concept of a ""Guiding Principle"" which is a character's overall goal, their commitment and code of conduct. This is optional, but confers bonuses when following the guiding principle and has costs when doing actions that violate it.  Finally, the concept of ""Void"" which is a sort of instant karma that ranks from 0 to 10. Void is an existential threat and a powerful resource, often treated as illegal.  These game mechanics tie directly into the narrative and canon. They force the player to carefully weight their decisions and lets the AI act as a judge of their activity.  # Machine Learning and AI Research Use-cases  Benchmarking by comparing LLM reasoning on grounded tactical scenarios including what-if and why, choosing the correct skills and attributes.  Multi-agent system reinforcement learning for cooperation and competiton, complete with faction dynamics and resource systems.  Identifying friend or foe, rules of engagement experiments under morally ambiguous situations.  AI governance and ethical questions and complex social situations that can be explored without risky use of real-world scenarios.  # Current State of my Code and Content  I'm in the process of building my own multi-agent system to test the game mechanics, with an AI gamemaster, AI players, and AI enemies, all as individual agents.  I would like to merge the game's multi-agent system with PettingZoo for more interesting and rigorous experiments once I'm confident in the game mechanics.  I'd also like to explore defining the prompts in different languages to see if that affects gameplay. Currently, I have evidence of emergent behavior, creative problem-solving and social interaction between the agents.  # Request for Comment  Is the graded outcome system actually novel methodology?  Does this canonical game world differentiate itself from LIGHT and other TextQuest type agentic scenarios?  What interesting scenarios and characters would you like to see play-tested?"
MachineLearning,1ojgl1b,[D]Just submitted: Multi-modal Knowledge Graph for Explainable Mycetoma Diagnosis (MICAD 2025),captainkink07,0,0,1761771859.0,https://www.reddit.com/r/MachineLearning/comments/1ojgl1b/djust_submitted_multimodal_knowledge_graph_for/,"Just submitted our paper to MICAD 2025 and wanted to share what we've been working on.  **The Problem:**  Mycetoma is a neglected tropical disease that requires accurate differentiation between bacterial and fungal forms for proper treatment. Current deep learning approaches achieve decent accuracy (85-89%) but operate as black boxes - a major barrier to clinical adoption, especially in resource-limited settings.  **Our Approach:**  We built the first multi-modal knowledge graph for mycetoma diagnosis that integrates:  * Histopathology images (InceptionV3-based feature extraction) * Clinical notes * Laboratory results * Geographic epidemiology data * Medical literature (PubMed abstracts)  The system uses retrieval-augmented generation (RAG) to combine CNN predictions with graph-based contextual reasoning, producing explainable diagnoses.  **Results:**  * 94.8% accuracy (6.3% improvement over CNN-only) * AUC-ROC: 0.982 * Expert pathologists rated explanations 4.7/5 vs 2.6/5 for Grad-CAM * Near-perfect recall (FN=0 across test splits in 5-fold CV)  **Why This Matters:**  Most medical AI research focuses purely on accuracy, but clinical adoption requires explainability and integration with existing workflows. Our knowledge graph approach provides transparent, multi-evidence diagnoses that mirror how clinicians actually reason - combining visual features with lab confirmation, geographic priors, and clinical context.  **Dataset:**  Mycetoma Micro-Image dataset from MICCAI 2024 (684 H&amp;E histopathology images, CC BY 4.0, Mycetoma Research Centre, Sudan)  **Code &amp; Models:**  GitHub: [https://github.com/safishamsi/mycetoma-kg-rag](https://github.com/safishamsi/mycetoma-kg-rag)  Includes:  * Complete implementation (TensorFlow, PyTorch, Neo4j) * Knowledge graph construction pipeline * Trained model weights * Evaluation scripts * RAG explanation generation  Happy to answer questions about the architecture, knowledge graph construction, or retrieval-augmented generation approach!"
MachineLearning,1oihs5e,[D] Conferences/Workshops for publishing about open-source software/libraries?,fullgoopy_alchemist,18,8,1761677137.0,https://www.reddit.com/r/MachineLearning/comments/1oihs5e/d_conferencesworkshops_for_publishing_about/,"Are there any conferences/workshops that accept contributions in terms of open-source software or libraries for ML-based tasks? There is no research novelty involved, but the software helps researchers with their experiment pipelines."
