subreddit,id,title,author,score,num_comments,created_utc,url,selftext
careerguidance,1oiyhk1,"After 11 years in the Naval construction force , and 15 years with USPS delivering mail...now what?",CuzzinBrI,24,12,1761724412.0,https://www.reddit.com/r/careerguidance/comments/1oiyhk1/after_11_years_in_the_naval_construction_force/,"I'm now 46 years old and our youngest kid is a senior and I am unemployed for the first time since I was old enough to work. During my stint with the Navy, I was a Seabee and got to see the world a little. One kid born in California, one in Hawaii and one in Okinawa, Japan and they were the main reason I didn't want to make a career out of the Navy; or be a ""lifer"" as they would say. In hindsight, i made the right choice and I have some great kids. . .I'd like to think due in part to dad (me lol) being there for them for everything. My wife and I were very close and did everything together and we have both been very involved in every aspect of life; including working together at the post office.     Neither of us ever thought we could ever get tired of each other no matter how much time we spent together. Sure, we could get on each others nerves here and there but making up is fun! Plus if ya'll don't ever have a disagreement then it is probably because ya'll don't communicate, but what we didn't consider was how people change, people aren't always honest, family members can be manipulative, couples tend to blame shift, kids are selfish, humans in general suck, we both suck with money, the lottery is elusive, etc.   I have been to a couple interviews but for the most part no one will interview me. Putting myself in the hiring person's position, I wouldn't interview me either cuz if I did background checks and had the choice between someone with 2 dwi in 2 years and someone without dwi's, I'm choosing the not problem child all day every day. For the record I haven't had a drink, or a dwi since 2021. I've been out of work since June.   I am very proficient at typing, but clerical I am not. I am great with tools and have an extensive knowledge of construction and maintenance along with safety and I'm good for lifting heavy things and like to get dirty. I don't have a ton of experience working on cars but I can do what I consider to be the basics: brakes, rotors, starter, alternator, bleeding brakes, calipers, etc.   I've considered becoming a handyman but idk if its nerves or what, or the fact I do not have an A type personality, but people tend to not trust me, or at least it feels that way. Too much eye contact? At this point with the wife and I not speaking much, idk what the future holds there but she is still at the post office and she is working another job and I want to make some income but out of the 100+ jobs I've applied for I was interviewed for Starbucks and they passed on me and a job with TDLR I missed the phone interview that morning cuz my dumbass overslept. I am not opposed to traveling as much as possible if it brings income in but any and all recommendations would be greatly appreciated!"
careerguidance,1ojlvfd,High paying finance career after depression ruining freshman and sophomore year gpa?,Mission_Ad_6657,0,1,1761785100.0,https://www.reddit.com/r/careerguidance/comments/1ojlvfd/high_paying_finance_career_after_depression/,"Is there any hope for me to be able to break into a role such as investment banking in my 20s? I was severely depressed and suicidal my first 2 years of college resulting in me not turning in a lot of work and missing exams. This has put my gpa at 2.8, and while I'm confident I can raise this a fair amount now that I'm doing better mentally and applying myself at university, I'm worried due to the intense competition in financial careers that I won't be able to pursue the career I'm passionate about. Anyone been in a similar situation and can share some advice?"
careerguidance,1oipvld,Is it ok for an employee to document all interactions with managers?,EnvironmentalCreme56,94,97,1761696316.0,https://www.reddit.com/r/careerguidance/comments/1oipvld/is_it_ok_for_an_employee_to_document_all/,"So I was written up and told I was basically on thin ice a while ago. I've been keeping my head down and everything seems okish. Management seems to want to get rid of a few people. When I was written up they talked about stuff they documented, fair enough, but some stuff was either lies or out of context.   I know from stuff I've read that managers should document everything but what about staff? Like now I won't ask my boss anything in person, only email so its documented (I don't work in an office/corporate type job, more in person thing). I also clarify everything with email too now, so if they say something to me that could in any possible way be misconstrued, I just email them like 'just to confirm...'. I want to cover my own butt as like I said they seem to be trying to get rid of people. I'm not American so hoping paper trails protect me worst case.   ----- Edit- Some additional info - Not in America  - This is the 3rd or 4th manager in this position this year - All other managers loved me - I love literally everything else about my job so just more hoping it passes - Not using AI or recording, just email and notes and such, don't want any legal issues - I just want to protect myself"
careerguidance,1ojljzb,How to pivot?,dwightdiggler,1,3,1761784206.0,https://www.reddit.com/r/careerguidance/comments/1ojljzb/how_to_pivot/,"Hello everyone, I’ve been in restaurants and and food and beverage industry my whole whole career, since I was 15. I have a high school diploma at 32 and I’m not sure what to do. Currently I’m a Sous chef at a corporate style venue. Any advice how to get out of the service industry?"
careerguidance,1ojlbsm,My boss made a counteroffer after I resigned — should I stay or leave?,StickAffectionate354,1,3,1761783581.0,/r/careeradvice/comments/1ojlbgv/my_boss_made_a_counteroffer_after_i_resigned/,
careerguidance,1oj2bsz,Is construction a good choice for starting a new career at 28?,Snufelupagus,11,17,1761738439.0,https://www.reddit.com/r/careerguidance/comments/1oj2bsz/is_construction_a_good_choice_for_starting_a_new/,"I worked as a line cook in kitchens since high school basically and now I’m starting a family and the money isn’t enough. Also just moved to Wisconsin, Walworth specifically. Any tips on starting a new career?? Thinkinking about starting a plumbing apprenticeship but concerned I might be too old."
careerguidance,1ojl8h6,What should I even do with my life?,ItzMaddie74,1,4,1761783339.0,https://www.reddit.com/r/careerguidance/comments/1ojl8h6/what_should_i_even_do_with_my_life/,"I (17F) am a Junior looking at colleges and majors. Before I say anything, I know I don’t need to know what I want to do with my life. However, all of these college counselors, college advisors, and other people, always ask me what my major is going to be and what I want to do with my life. And all of these colleges are mainly focused on certain majors. But the truth is, I don’t know what to do with my life!!! I know this is normal, but god this is literally keeping me up at night constantly. I can already smell the comments- “You’re young! You’ve got time!” I KNOW.   These are my strengths- I love writing. I wanted to have some sort of English major but they don’t pay well (my ideal yearly salary would be $90,000, I live in the U.S). I have written four books and I’m currently working on a YouTube show!  I love animals! I have considered being a Veterinarian but my aunt was one and she told me her experience and now I’m leaning away from it. I have an interest in photography and other arts.   I am a very creative person, and I also love finding definitive answers, that’s how I work as a person. I also am comfortable stepping up into a leader position and really enjoy it.   There’s more about me of course but I figured this could help you readers help me out with some sense of direction?   Thank you!!!"
careerguidance,1ojbtli,Its a chemical engineer bachelor better than a chemistry bachelor?,Wh1t3W1n3,4,13,1761761054.0,https://www.reddit.com/r/careerguidance/comments/1ojbtli/its_a_chemical_engineer_bachelor_better_than_a/,"Hi, I think the answer at first glance is chemical engineering because of a higher pay right after beginning to work, but I want to have a Masters degree too. I feel pressured to think a higher pay is better, but I want to do a Master, specially a career related to geology. I don't know if it's a bad Idea, but I don't want to feel that im missing out now that I already have a place for a Chemical study. Is there other Masters degrees that would make more sense?"
datascience,1oh4tzk,"Weekly Entering &amp; Transitioning - Thread 27 Oct, 2025 - 03 Nov, 2025",AutoModerator,7,24,1761537697.0,https://www.reddit.com/r/datascience/comments/1oh4tzk/weekly_entering_transitioning_thread_27_oct_2025/,"Welcome to this week's entering &amp; transitioning thread! This thread is for any questions about getting started, studying, or transitioning into the data science field. Topics include:  * Learning resources (e.g. books, tutorials, videos) * Traditional education (e.g. schools, degrees, electives) * Alternative education (e.g. online courses, bootcamps) * Job search questions (e.g. resumes, applying, career prospects) * Elementary questions (e.g. where to start, what next)  While you wait for answers from the community, check out the [FAQ](https://www.reddit.com/r/datascience/wiki/frequently-asked-questions) and Resources pages on our wiki. You can also search for answers in [past weekly threads](https://www.reddit.com/r/datascience/search?q=weekly%20thread&amp;restrict_sr=1&amp;sort=new)."
datascience,1oje977,So what do y’all think of the Amazon layoffs?,Lamp_Shade_Head,116,64,1761766511.0,https://www.reddit.com/r/datascience/comments/1oje977/so_what_do_yall_think_of_the_amazon_layoffs/,"I’ve heard that many BIEs and data professionals have been laid off recently. It’s quite unsettling to see, and I’m feeling anxious both as an employee, since it could happen at my company too and as a job seeker, knowing that many of those laid-off professionals will now be competing in the job market alongside me."
datascience,1oj9qua,Light read on the environmental footprint of data centers,ArugulaImpossible134,10,2,1761756538.0,https://www.reddit.com/r/datascience/comments/1oj9qua/light_read_on_the_environmental_footprint_of_data/,"Hi guys,   I just wrote this article on Medium I would appreciate any feedback and I would like to know what you think about the matter (since it touches also a bit on ethics).  Link: [https://medium.com/@sokratisliakos/why-data-warehouses-are-an-environmental-paradox-1d1b0a021929?sk=6fa49ae6d3f8925bfb36f458aa63b79a](https://medium.com/@sokratisliakos/why-data-warehouses-are-an-environmental-paradox-1d1b0a021929?sk=6fa49ae6d3f8925bfb36f458aa63b79a)"
datascience,1oigf8k,burning out because nothing takes as short as the time im expected to complete tasks,thro0away12,84,20,1761674097.0,https://www.reddit.com/r/datascience/comments/1oigf8k/burning_out_because_nothing_takes_as_short_as_the/,"I work as a data engineer/analytics engineer and am given about 2 weeks to fully develop 3-4 datasets that are used in the backend for various applications. The issue is the following:  1. Theoretically, if I had even 80% clarity in requirements, I could probably finish a dataset in a span of 1-3 days. However, this is never the case - the requirements are frequently 50% clear, I have to figure that out along developing the dataset. When there’s an issue upstream of me, I have to go back to the source files and dig deep why something is missing. I have to wait on another engineer frequently in the process to either QA why something is missing or merge my pull requests which has frequent delays.   2. In between all of this work, I frequently get asked to make enhancements or fix bugs from previous work that can easily eat 1-3 days. Some of these bugs are random and occur because the source data upstream of me randomly changed that broke my entire process. Enhancements sound simple in theory until I actually work on it.   3. There’s no standard QA process. I told my boss I wanted to develop scripts to do QA as frequently in the past if we had data issues, I would be notified by either my boss or a stakeholder because they happened to notice the issue. I figured if I run a daily script where I can get an automated email that shows all my datasets and what’s going on, it can be easier to be proactive rather than reactive. My boss said that this is something another team is working on developing but there’s no sign that there is such a thing being developed and developing a QA process for every individual project is entirely on me to figure out   4. There’s NO documentation. My team is trying to get better at this but all my projects have been a product of zero past documentation. In order to get better at this, I’m expected to create documentation on top of all this work. Documentation can easily take me 1-2 days for each project and sometimes it gets pushed to the side because of focusing on 1-3.  Even documenting on Jira easily takes me 30 mins - 1 hour   5. Add 3 hours of meeting a day on this already full plate    Instead of 3 projects in 2 weeks, I feel if my focus was on just one project - from development, QA, documentation, it would be way more manageable. But there isn’t really an option on my team as they’re obsessed with scaling up, I’m frequently told everything is a priority. My eating and sleeping schedule had gotten so messed up in the span of the past few months - I don’t have time to make breakfast, lunch or dinner and end up skipping meals a lot. I wish to get a new job and would have easily started applying now if the economy wasn’t so bad.   I’m wondering if others have experienced similar."
datascience,1oicuu9,"Bank of America: AI Is Powering Growth, But Not Killing Jobs (Yet)",CryoSchema,44,14,1761666226.0,https://www.interviewquery.com/p/bank-of-america-ai-economy-job-impact,
datascience,1oirqlb,Statistics blog/light read. Thoughts?,ArugulaImpossible134,7,11,1761701415.0,https://www.reddit.com/r/datascience/comments/1oirqlb/statistics_bloglight_read_thoughts/,"Hi everybody, I just posted my first article on Medium and I would like some feeback (both positive and negative). Is it something that anyone would bother reading? Do you find it interesting as a light read?   I really enjoy stats and writing so I wanted to merge them in some way.  Link: [https://medium.com/@sokratisliakos/on-the-arbitrariness-or-lack-thereof-of-α-0-05-4d5965762646](https://medium.com/@sokratisliakos/on-the-arbitrariness-or-lack-thereof-of-α-0-05-4d5965762646)  Thanks in advance"
datascience,1ojb3u5,How I would land FAANG DS in 2025,LeaguePrototype,0,15,1761759518.0,https://www.reddit.com/r/datascience/comments/1ojb3u5/how_i_would_land_faang_ds_in_2025/,"step 1: Have 3-5 years experience for L4 (No such thing as Junior DS at FAANG)  step 2: Don't not have 3-5 years experience  step 3: Get MSc in Stats/Comp sci./Physics/etc. (do not go for DS degree)  step 4: Look on career site for which locations they are hiring for DS, move or be ready to move there. Easier to get headcount in Big US offices, latin America, Eastern Europe, India  step 5: Look what kind of roles they are hiring for and what matches your skillset  step 6: Tailor your resume, create projects if you don't have experience, for the roles they are hiring for. DS means a lot of things, and big companies are looking for specialists not generalists. There's someone to do ops, someone to do cloud engineering, someone to do dashboards, etc.  step 7: Apply as much as you can, reach out and get referral from someone. Don't talk yourself out of applying  step 8: Study at a bare minimum 20-50 hours for each hour of interview. Make sure you study for topics relevant to the role (ex. if it's in product analytics you won't have to know much ML ops)  step 9: Interview well. You have to be perfect when it comes to the fundamentals. With an 8/10 performance you will either be rejected or request follow up interviews, anything below that doesn't cut it. Your english and fundamental technical skills must be perfect. Any signs of incompetence when it comes to the basics will be red flags. You must know 'why' not just the 'what'."
datascience,1oiaj5d,"Your feedback got my resource list added to the official ""awesome-datascience"" repo",DeepAnalyze,15,4,1761660897.0,https://www.reddit.com/r/datascience/comments/1oiaj5d/your_feedback_got_my_resource_list_added_to_the/,"Hi everyone,  A little while back, I shared my curated list of data science resources here as a public GitHub repo. The feedback was really valuable.  Thanks for all the suggestions and feedback. Here's what was improved thanks to your ideas:  * **Added new sections:** MLOps, AI Applications &amp; Platforms, and Cloud Platforms &amp; Infrastructure to make the list more comprehensive. * **Reworked the structure:** Split some bulky sections up. Hopefully now it's less overwhelming and easier to navigate. * **Packed more useful Python:** Added more useful Python libraries into each section to help find the right tool faster. * **Set up auto-checks**: Implemented an automatic check for broken links to keep the list fresh and reliable.  A nice outcome: the list is now part of the main ""Awesome Data Science"" repository, which many of you probably know.  If you have more suggestions, I'd love to hear them in the comments. I'm especially curious if adding new subsections for Books or YouTube channels within existing chapters (alongside Resources and Tools) would be useful.  The list is here: [View on GitHub](https://github.com/PavelGrigoryevDS/awesome-data-analysis#readme)  P.S. Thanks again. This whole process really showed me how powerful Reddit can be for getting real, expert feedback."
datascience,1ohflw3,"OK, I accept that this is the worst post title I've ever made...",ElectrikMetriks,356,12,1761574635.0,https://i.redd.it/v4tx388cxnxf1.png,
datascience,1ohsucs,"For an A/B test where the user is the randomization unit and the primary metric is a ratio of total conversions over total impressions, is a standard two-proportion z-test fine to use for power analysis and testing?",PathalogicalObject,49,13,1761604654.0,https://www.reddit.com/r/datascience/comments/1ohsucs/for_an_ab_test_where_the_user_is_the/,"My boss seems to think it should be fine, but there's variance in how many impressions each user has, so perhaps I'd need to compute the ICC (intraclass correlation) and use that to compute the design effect multiplier (DEFF=1+(m-1) x ICC)?  It also appears that a GLM with a Wald test would be a appropriate in this case, though I have little experience or exposure to these concepts.   I'd appreciate any resources, advice, or pointers. Thank you so much for reading!"
datascience,1ohp04q,"Kiln Agent Builder (new): Build agentic systems in minutes with tools, sub-agents, RAG, and context management [Kiln]",davernow,7,3,1761595626.0,https://i.redd.it/mn63lbh3opxf1.png,"We just added an interactive Agent builder to [the GitHub project Kiln](https://github.com/Kiln-AI/Kiln). With it you can build agentic systems in under 10 minutes. You can do it all through our UI, or use our python library.  What is it? Well “agentic” is just about the most overloaded term in AI, but Kiln supports everything you need to build agents:  * [Tool Use](https://docs.kiln.tech/docs/agents#tool-use) * [Multi-Actor Interaction (aka subtasks)](https://docs.kiln.tech/docs/agents#multi-actor-interaction-aka-subtasks) * [Goal Directed, Autonomous Looping &amp; Reasoning](https://docs.kiln.tech/docs/agents#goal-directed-autonomy-and-reasoning) * [State &amp; Memory](https://docs.kiln.tech/docs/agents#state-and-memory)  **Context Management with Subtasks (aka Multi-Actor Pattern)**  Context management is the process of curating the model's context (chat/tool history) to ensure it has the right data, at the right time, in the right level of detail to get the job done.  With Kiln you can implement context management by dividing your agent tasks into subtasks, making context management easy. Each subtask can focus within its own context, then compress/summarize for the parent task. This can make the system faster, cheaper and higher quality. See our [docs on context management](https://docs.kiln.tech/docs/agents#context-management) for more details.  **Eval &amp; Optimize Agent Performance**  Kiln agents work with [Kiln evals](https://docs.kiln.tech/docs/evaluations) so you can measure and improve agent performance:  * Find the ideal model to use, balancing quality, cost and speed * Test different prompts * Evaluate end-to-end quality, or focus on the quality of subtasks * Compare different agent system designs: more/fewer subtasks  **Links and Docs**  Some links to the repo and guides:  * [Kiln AI on Github - 4k stars](https://github.com/Kiln-AI/Kiln) * [Docs for Kiln Agents](https://docs.kiln.tech/docs/agents) * [Kiln Discord](https://getkiln.ai/discord) * [Homepage](https://kiln.tech/)  Feedback and suggestions are very welcome! We’re already working on custom evals to inspect the trace, and make sure the right tools are used at the right times. What else would be helpful? Any other agent memory patterns you’d want to see?"
datascience,1ogwru2,Anyone looking to read the third edition of Deep Learning With Python?,yaymayhun,97,11,1761514766.0,https://www.reddit.com/r/datascience/comments/1ogwru2/anyone_looking_to_read_the_third_edition_of_deep/,The book is now available to read online for free: https://deeplearningwithpython.io/chapters/
datascience,1ohw7zt,How to get hired in USA?,Due-Duty961,0,26,1761613538.0,https://www.reddit.com/r/datascience/comments/1ohw7zt/how_to_get_hired_in_usa/,How to get hired as a Data Scientist/ Analyst (5yr exp) from France in USA? Is it better if I switch to CS because it is more in demand? thanks
datascience,1of2sfs,The Great Stay — Here’s the New Reality for Tech Workers,KitchenTaste7229,75,30,1761324293.0,https://www.interviewquery.com/p/the-great-stay-tech-workers-ai-fear,Do you think you're part of this new phenomenon called The Great Stay?
datascience,1oehj29,Any other free options that are similar to ShotBot?,Party_Bus_3809,8,8,1761259418.0,https://youtu.be/H3nGXVSQww8?si=7qwcbRtpG5tZMwLD,
datascience,1od5zca,What’s next for a 11 YOE data scientist?,appleciderv,241,86,1761133551.0,https://www.reddit.com/r/datascience/comments/1od5zca/whats_next_for_a_11_yoe_data_scientist/,"Hi folks, Hope you’re having a great day wherever you are in the world.  Context: I’ve been in the data science industry for the past 11 years. I started my career in telecom, where I worked extensively on time series analysis and data cleaning using R, Java, and Pig.  After about two years, I landed my first “data scientist” role in a bank, and I’ve been in the financial sector ever since. Over time, I picked up Python, Spark, and TensorFlow to build ML models for marketing analytics and recommendation systems. It was a really fun period — the industry wasn’t as mature back then. I used to get ridiculously excited whenever new boosting algorithms came out (think XGBoost, CatBoost, LightGBM) and spent hours experimenting with ensemble techniques to squeeze out higher uplift.  I also did quite a bit of statistical A/B testing — not just basic t-tests, but full experiment design with power analysis, control-treatment stratification, and post-hoc validation to account for selection bias and seasonality effects. I enjoyed quantifying incremental lift properly, whether through classical hypothesis testing or uplift modeling frameworks, and working with business teams to translate those metrics into campaign ROI or customer conversion outcomes.  Fast forward to today — I’ve been at my current company for about two years. Every department now wants to apply Gen AI (and even “agentic AI”) even though we haven’t truly tested or measured many real-world efficiency gains yet. I spend most of my time in meetings listening to people talk all day about AI. Then I head back to my table to do prompt engineering, data cleaning, testing, and evaluation. Honestly, it feels off-putting that even my business stakeholders can now write decent prompts. I don’t feel like I’m contributing much anymore. Sure, the surrounding processes are important — but they’ve become mundane, repetitive busywork.  I’m feeling understimulated intellectually and overstimulated by meetings, requests, and routine tasks. Anyone else in the same boat? Does this feel like the end of a data science journey? Am I far too gone? It’s been 11 years for me, and lately, I’ve been seriously considering moving into education — somewhere I might actually feel like I’m contributing again."
datascience,1ode6j8,Create stable IDs in DBT,Unhappy_Technician68,7,5,1761152941.0,https://www.reddit.com/r/datascience/comments/1ode6j8/create_stable_ids_in_dbt/,I'm creating a table for managing custoemrs between different locations and uniting their profiles at various outlets for an employer.  I've been doing more modelling in my career than ETL stuff.  I know SQL pretty well but I'm struggling a bit to set up the DBT table in a way where it can both update daily AND maintain stable IDs.  It overrights them.  We can set up github actions but I'm not really sure what would be the appropriate way to solve this issue.
